id,infocube_id_person,name_badgeinhaber,id,name,status,noga
58,5818623,Helen Fässler-Eiermann,142633,Hääss-Chammer-Gnosseschaft Appenzell,active,Other interest groups
58,5818623,Helen Fässler-Eiermann,5818826,Lokal Appenzell GmbH,active,"Restaurants, cafes, snack bars, tea rooms, ice-cream parlours"
59,,Chantal Aeby Pürro,,,,
6,,Kind Andrea,,,,
60,,Hans Kuno Schweiger,,,,
61,,Peter Graf,,,,
62,,Miriam Wetter,,,,
64,,Roland Seiler,,,,
65,,Sybille Oetliker,,,,
66,5472975,Ernesto Engel,588312,Katz Kunststoff-Ausbildungs- und Technologie-Zentrum,active,"Further vocational training, adult education"
66,5472975,Ernesto Engel,594905,Kunststoff Verband Schweiz (KVS),active,Activities of business and employers membership organisations
66,5472975,Ernesto Engel,5552419,Verband Kunststoff-Rohre und Rohrleitungsteile,active,Activities of professional membership organisations
67,,Ingrid Hess,,,,
68,,Hans-Georg Bächtold,,,,
69,765735,Hansruedi Streiff,397971,Lignum Holzwirtschaft Schweiz,active,Activities of business and employers membership organisations
69,765735,Hansruedi Streiff,40738,Verband Holzindustrie Schweiz HIS,active,Activities of professional membership organisations
7,,Simon Affolter,,,,
70,,Cahannes Dagobert,,,,
71,4444336,Priska Föhn,24114,Möbelfabrik Betschart AG,active,Manufacture of other furniture
71,4444336,Priska Föhn,229860,Personalvorsorgestiftung der Möbelfabrik Betschart AG,active,Pension funding
71,4444336,Priska Föhn,4444479,Peter Föhn-Heinzer Holding AG,active,Activities of other holding companies
72,329859,Christian Melly,21043,Société d'expansion touristique de Zinal SA,active,Travel agency activities
72,329859,Christian Melly,725978,Les 4 Vallées SA,active,Activities of sport clubs
72,329859,Christian Melly,7027480,Remontées Mécaniques de Grimentz - Zinal SA,active,"Passenger transport by cableways, funiculars and ski-tows"
72,329859,Christian Melly,5629150,Inspection des finances du canton du Valais,active,General public administration activities
73,,Paul-André Simon,,,,
74,5089791,Joël A. Thüring,6503707,aspero ag,active,Activities of insurance agents and brokers
75,1008819,Kuno Hämisegger,598190,Stiftung Knabenkantorei Basel,active,"Cultural, education, scientific and research organisations"
75,1008819,Kuno Hämisegger,40711,Schweizerische Bankiervereinigung (SwissBanking),active,Activities of professional membership organisations
76,,Antoine Carraux,,,,
77,5454878,Reto Wiesli,5455082,Fachstelle für Gesundheitspolitik polsan GmbH,active,Business and other management consultancy activities
78,,Jürg Wittwer,,,,
8,5315606,Raphaël Tschanz,260570,UBS AG,active,Big banks
8,5315606,Raphaël Tschanz,766457,UBS AG,active,Big banks
80,404341,Kurt Rohrbach,811871,Onyx Energie Mittelland AG,active,Activities of other holding companies
80,404341,Kurt Rohrbach,4640944,"""Organisation der Schweizerischen Stromverbundunternehmen"" (Swisselectric)",active,Activities of business and employers membership organisations
80,404341,Kurt Rohrbach,310367,Verband Schweizerischer Elektrizitätsunternehmen (VSE),active,Activities of business and employers membership organisations
80,404341,Kurt Rohrbach,19021,AEK Energie AG,active,Trade of electricity
80,404341,Kurt Rohrbach,6653957,BKW AG,active,Activities of other holding companies
80,404341,Kurt Rohrbach,5025,Groupe E SA,active,Distribution of electricity
80,404341,Kurt Rohrbach,9589,Kraftwerke Oberhasli AG,active,Production of electricity
81,,Christoph Dietler,,,,
82,5398217,Rudolf Horber,,,,
83,46828,Chantal Balet,6390419,Fondation equal-salary,active,Other interest groups
83,46828,Chantal Balet,5084217,"Banque Cantonale du Valais, succursale de Monthey",active,Cantonal banks
83,46828,Chantal Balet,5084348,"Banque Cantonale du Valais, succursale de Martigny",active,Cantonal banks
83,46828,Chantal Balet,5085478,Walliser Kantonalbank,active,Cantonal banks
83,46828,Chantal Balet,5085479,Walliser Kantonalbank,active,Cantonal banks
83,46828,Chantal Balet,5243952,Implenia AG,active,Investment intermediation
83,46828,Chantal Balet,134808,Les Domaines de Robert Gilliard SA,active,Growing of grapes
83,46828,Chantal Balet,268030,Schweizerische Stiftung für die Erforschung der Muskelkrankheiten,active,Healthcare organisations
83,46828,Chantal Balet,395415,Fondation Louis Moret,active,"Cultural, education, scientific and research organisations"
83,46828,Chantal Balet,4120234,"Banque Cantonale du Valais, succursale de Sierre",active,Cantonal banks
83,46828,Chantal Balet,4121125,"Banque Cantonale du Valais, succursale de Sion",active,Cantonal banks
83,46828,Chantal Balet,362987,VAUDOISE ASSURANCES HOLDING SA,active,Activities of other holding companies
83,46828,Chantal Balet,1590,Banque cantonale du Valais,active,Cantonal banks
83,46828,Chantal Balet,12237,OLF SA,active,"Wholesale of stationery, books and newspapers"
83,46828,Chantal Balet,22927,Robert Gilliard SA Vins,active,Manufacture of wine from grape
83,46828,Chantal Balet,116469,Fondation Leenaards,active,Charitable institutions
83,46828,Chantal Balet,115182,Fondation de financement de la Caisse de pension VAUDOISE ASSURANCES,active,Pension funding
83,46828,Chantal Balet,217172,Caisse de pension VAUDOISE ASSURANCES,active,Pension funding
83,46828,Chantal Balet,17746,"VAUDOISE GENERALE, Compagnie d'Assurances SA",active,Accident and indemnity insurance
83,46828,Chantal Balet,17747,"VAUDOISE VIE, Compagnie d'Assurances SA",active,Accident and indemnity insurance
83,46828,Chantal Balet,352772,"MUTUELLE VAUDOISE, Société Coopérative",active,Health insurance
84,1046083,Renate Hotz,5436471,Renate Hotz Communications AG,active,Public relations and communication activities
85,,Hans-Ulrich Hunziker,,,,
86,,Barbara Küttel,,,,
87,6328680,Patrick Hofstetter,6329079,Verein Energieallianz,active,Other interest groups
88,,Jonas Glanzmann,,,,
89,,Nicole Werner,,,,
9,5716363,Stefan Wyer,612375,GFW Development AGlll,active,Other business support service activities n.e.c.
9,5716363,Stefan Wyer,4551851,Dr. Schenker Kommunikationszentrum für Wirtschaft und Politik AG,active,Public relations and communication activities
90,5767738,Marcel Kreber,292138,Stiftung des Schweizerischen Bierbrauervereins für Wissenschaftliche Forschung,active,"Cultural, education, scientific and research organisations"
92,5446271,Wyss Gräber Andrea,,,,
93,,Markus Allemann,,,,
94,4909799,Walter Stüdeli,4909939,"Köhler, Stüdeli & Partner GmbH",active,Public relations and communication activities
94,4909799,Walter Stüdeli,673377,Schweizerischer Verband für komplementärmedizinische Heilmittel,active,Activities of professional membership organisations
95,,Kurt Howald,,,,
96,,Jürgen Schulz,,,,
97,5131473,In-Albon Hans-Peter,15092,Schweizerische Technische Fachschule Winterthur (STF),active,Technical and vocational upper secondary education
97,5131473,In-Albon Hans-Peter,221374,Paritätische Krankenversicherung für Branchen der Gebäudetechnik,active,Accident and indemnity insurance
97,5131473,In-Albon Hans-Peter,286830,Sozialfonds VSEI,active,Other social activities without accommodation
97,5131473,In-Albon Hans-Peter,5131511,Paritätische Landeskommission der Schweizerischen Elektro- und Telekommunikations-Installationsbranche (PLK),active,Activities of professional membership organisations
98,6804000,Klaus Künzli,5177285,Belvoirpark AG,active,"Restaurants, cafes, snack bars, tea rooms, ice-cream parlours"
98,6804000,Klaus Künzli,5177321,Sasso San Gottardo SA,active,Museums activities
98,6804000,Klaus Künzli,5935272,Schweizerischer Gewerbeverband,active,Activities of professional membership organisations
98,6804000,Klaus Künzli,6356522,Genossenschaft Dr. Frano Della Casa,active,Management of real estate on a fee or contract basis
98,6804000,Klaus Künzli,5300480,Restaurant Vieux-Bois SA,active,"Restaurants, cafes, snack bars, tea rooms, ice-cream parlours"
98,6804000,Klaus Künzli,70954,Schweizer Reisekasse (Reka) Genossenschaft,active,"Holiday apartments, holiday homes"
98,6804000,Klaus Künzli,82756,Kongress & Kursaal Bern AG,active,"Restaurants, cafes, snack bars, tea rooms, ice-cream parlours"
98,6804000,Klaus Künzli,231161,Personalvorsorgestiftung der Geschäftsstelle des Schweizerischen Gewerbeverbandes,active,Pension funding
98,6804000,Klaus Künzli,626292,Hotel Allegro Bern AG,active,"Hotels, inns and guesthouses with restaurants"
98,6804000,Klaus Künzli,709942,"Gastroconsult SA, succursale de Fribourg",active,"Accounting, bookkeeping and auditing activities; tax consultancy"
98,6804000,Klaus Künzli,710163,Gastroconsult SA,active,"Accounting, bookkeeping and auditing activities; tax consultancy"
98,6804000,Klaus Künzli,712937,"Gastroconsult AG, Zweigniederlassung",active,"Accounting, bookkeeping and auditing activities; tax consultancy"
98,6804000,Klaus Künzli,715474,Gastroconsult AG,active,"Accounting, bookkeeping and auditing activities; tax consultancy"
98,6804000,Klaus Künzli,761941,Gastroconsult AG,active,"Accounting, bookkeeping and auditing activities; tax consultancy"
98,6804000,Klaus Künzli,705391,Gastroconsult SA,active,"Accounting, bookkeeping and auditing activities; tax consultancy"
98,6804000,Klaus Künzli,705925,Gastroconsult AG,active,"Accounting, bookkeeping and auditing activities; tax consultancy"
98,6804000,Klaus Künzli,707920,"Gastroconsult SA, succursale de Saignelégier",active,"Accounting, bookkeeping and auditing activities; tax consultancy"
98,6804000,Klaus Künzli,707991,"Gastroconsult AG, Succursale di Cadempino",active,"Accounting, bookkeeping and auditing activities; tax consultancy"
98,6804000,Klaus Künzli,708551,Gastroconsult AG,active,"Accounting, bookkeeping and auditing activities; tax consultancy"
98,6804000,Klaus Künzli,827077,Hotel Consulting Group AG,active,"Accounting, bookkeeping and auditing activities; tax consultancy"
98,6804000,Klaus Künzli,108662,GastroSuisse,active,Activities of professional membership organisations
98,6804000,Klaus Künzli,696949,Gastroconsult AG,active,"Accounting, bookkeeping and auditing activities; tax consultancy"
98,6804000,Klaus Künzli,701718,Gastroconsult AG,active,"Accounting, bookkeeping and auditing activities; tax consultancy"
98,6804000,Klaus Künzli,703616,Gastroconsult AG,active,"Accounting, bookkeeping and auditing activities; tax consultancy"
99,,Marie-Jo Girardin,,,,
