id,infocube_id_person,name_badgeinhaber,id,name,status,noga
,,Werni Birrer,,,,
,,Gebhard Marc,,,,
,,Fischer Gabriel,,,,
,,Brunner Markus,,,,
,,Egger Beda,,,,
,,Gisi Barbara,,,,
,,With Peter,,,,
,,Seiler Daniel,,,,
,,Zijdenbos Theo,,,,
,,Schweri Kim Lara,,,,
,,Hugentobler Manuela Annette,,,,
,,Barioni Séverine,,,,
,,Neirynck Julien,,,,
1,370844,Vincenzo Pedrazzini,570304,Pedrazzini Holding AG,active,Activities of other holding companies
1,370844,Vincenzo Pedrazzini,6908867,Pedrazzini Campo SA,active,Research and experimental development on social sciences and humanities
1,370844,Vincenzo Pedrazzini,8761,Isler & Pedrazzini AG,active,"Patent lawyers, patent licensing companies"
10,1030082,Max Nötzli,353677,Auto-i-DAT AG,active,Computer programming activities
10,1030082,Max Nötzli,313275,auto-schweiz VEREINIGUNG SCHWEIZER AUTOMOBIL-IMPORTEURE,active,Activities of business and employers membership organisations
10,1030082,Max Nötzli,597312,Stiftung Auto Recycling Schweiz,active,Other interest groups
100,270640,Stefan Kilchenmann,730959,Grünau AG,active,Management of real estate on a fee or contract basis
100,270640,Stefan Kilchenmann,5532595,SpoHaWe AG,active,Buying and selling of own real estate
100,270640,Stefan Kilchenmann,5536332,Livesystems AG,active,Computer programming activities
100,270640,Stefan Kilchenmann,4710674,kw la soupe GmbH,active,"Restaurants, cafes, snack bars, tea rooms, ice-cream parlours"
101,527127,Kurt Wilhelm,714250,Sanitas Krankenversicherung,active,Health insurance
102,,Stefan Jakob,,,,
103,,Dieter Meile,,,,
104,,Daniela Lehmann,,,,
105,669335,Christine Davatz-Höchner,5654541,"Stiftung für Innovation, Entwicklung und Forschung Graubünden",active,Research and experimental development on social sciences and humanities
105,669335,Christine Davatz-Höchner,5398325,Stiftung Privatschulregister Schweiz,active,"Cultural, education, scientific and research organisations"
105,669335,Christine Davatz-Höchner,6755948,IGKG Interessengemeinschaft Kaufmännische Grundbildung Schweiz,active,"Cultural, education, scientific and research organisations"
105,669335,Christine Davatz-Höchner,117058,swissskills,active,"Cultural, education, scientific and research organisations"
105,669335,Christine Davatz-Höchner,231161,Personalvorsorgestiftung der Geschäftsstelle des Schweizerischen Gewerbeverbandes,active,Pension funding
105,669335,Christine Davatz-Höchner,232861,Pestalozzi-Stiftung für die Förderung der Ausbildung Jugendlicher aus schweizerischen Berggegenden,active,"Cultural, education, scientific and research organisations"
106,103036,Gallus Cadonau,395107,Internationale Solarmobil Föderation ISF,active,Activities of sport clubs
106,103036,Gallus Cadonau,117045,Schweizerische Greina-Stiftung (SGS) zur Erhaltung der alpinen Fliessgewässer,active,Other interest groups
106,103036,Gallus Cadonau,6840148,Solar Agentur Schweiz,active,Other interest groups
107,5774114,Martin Rufer,20957,Proviande Genossenschaft,active,Activities of business and employers membership organisations
107,5774114,Martin Rufer,403502,Schweizerischer Bauernverband (SBV),active,Activities of business and employers membership organisations
108,6815095,Martin Pidoux,403502,Schweizerischer Bauernverband (SBV),active,Activities of business and employers membership organisations
109,6607224,Raphaël Ciocchi,,,,
11,4589513,Martin Flügel,117050,Schweizerische Sozialpartner-Stiftung für die Auffangeinrichtung gemäss Artikel 60 BVG (Stiftung Auffangeinrichtung BVG),active,Pension funding
11,4589513,Martin Flügel,4645644,Verein ARC -  Bildungsinstitut für Arbeitnehmende,active,Activities of trade unions
110,,Alexander Segert,,,,
111,5686206,Bettina Ramseier Rey,5068611,CURAVIVA - Verband Heime und Institutionen Schweiz,active,Charitable institutions
111,5686206,Bettina Ramseier Rey,595976,ARGOS SA,active,Activities of insurance agents and brokers
111,5686206,Bettina Ramseier Rey,7002607,BESA Care AG,active,Healthcare organisations
111,5686206,Bettina Ramseier Rey,115912,Fondation du foyer d'accueil Le Christ-Roi,active,Residential nursing care activities
112,5754911,Bruno Henggi,163174,Interpharma,active,Other research and experimental development on natural sciences and engineering
113,,Pascal Gentinetta,,,,
114,520100,Urs Wellauer,268108,Schweizerischer Bäcker-Confiseurmeister-Verband,active,Activities of professional membership organisations
115,,Florence Schurch,,,,
116,5770043,Beat Meiner,645781,Stiftung Alpenruhe Saanen,active,Other residential homes
116,5770043,Beat Meiner,7203683,Schweizerische Flüchtlingshilfe / SFH,active,Charitable institutions
119,p26002615664,Cornelia Stamm Hurter,,,,
120,218441,Rolf Hartl,5208161,Stiftung Klimarappen,active,Other interest groups
120,218441,Rolf Hartl,104098,Erdöl - Vereinigung (EV),active,Activities of professional membership organisations
120,218441,Rolf Hartl,7052862,Stiftung Klimaschutz und CO2-Kompensation KliK,active,Other interest groups
120,218441,Rolf Hartl,216315,Hutter Dynamics AG,active,Maintenance and repair of motor vehicles
120,218441,Rolf Hartl,221414,Hutter Dynamics AG Schaffhausen,active,Maintenance and repair of motor vehicles
120,218441,Rolf Hartl,4453219,Energie-Agentur der Wirtschaft (EnAW),active,Activities of business and employers membership organisations
121,,Harald Burgener,,,,
122,,Werner Müller,,,,
123,,Dominik Bachmann,,,,
124,5654519,Mirjam Ballmer,651985,Theres und Gerhard Kraus-Vogt Stiftung,active,"Cultural, education, scientific and research organisations"
125,,Lucia Döbeli,,,,
126,p22005361383,Aliki Panayides,,,,
127,,Annina Schneider,,,,
128,25037,Herbert Winter,821960,SIMON UND HILDEGARD ROTHSCHILD-STIFTUNG,active,"Cultural, education, scientific and research organisations"
128,25037,Herbert Winter,376445,Turavent Oil GmbH,active,"Wholesale of solid, liquid and gaseous fuels and related products"
128,25037,Herbert Winter,618293,Phibro GmbH,active,"Wholesale of solid, liquid and gaseous fuels and related products"
128,25037,Herbert Winter,203908,Adolf und Mary Mil-Stiftung,active,Charitable institutions
128,25037,Herbert Winter,196915,Saly Mayer Memorial Stiftung,active,"Cultural, education, scientific and research organisations"
128,25037,Herbert Winter,199304,Memorial Stiftung des Schweizerischen Israelitischen Gemeindebundes,active,Charitable institutions
128,25037,Herbert Winter,275833,Sikna-Stiftung,active,Residential nursing care activities
128,25037,Herbert Winter,688803,Stiftung Jüdische Zeitgeschichte an der ETH Zürich zur Sicherung und Erschliessung historischer Quellen in der Schweiz,active,"Cultural, education, scientific and research organisations"
129,18642,Hans-Rudolf Müller,324882,AXA Assurances SA,active,Accident and indemnity insurance
129,18642,Hans-Rudolf Müller,18526,AXA Versicherungen AG,active,Accident and indemnity insurance
129,18642,Hans-Rudolf Müller,324858,"AXA Versicherungen AG, Zweigniederlassung St. Gallen",active,Accident and indemnity insurance
129,18642,Hans-Rudolf Müller,324875,AXA Versicherungen AG,active,Accident and indemnity insurance
129,18642,Hans-Rudolf Müller,324878,AXA Versicherungen AG,active,Accident and indemnity insurance
129,18642,Hans-Rudolf Müller,324880,"AXA Assicurazioni SA, succursale di Lugano",active,Accident and indemnity insurance
13,5414310,Regula Mühlebach,,,,
131,,Morten Keller,,,,
132,6942944,Kalim Ghulam,800604,POWERcondens AG,active,Wholesale of other machinery and equipment
133,,Christof Berger,,,,
134,,Charles Buser,,,,
136,4088504,Susanne Brunner,671386,Sigg Innenausbau GmbH,active,Interior joinery
137,1014565,Paul Aenishänslin,4608992,Paul Aenishänslin Public Affairs & Communications (PAE-PAC),active,Advertising agencies
138,1067385,Marcel Sennhauser,296184,STV-Verlags AG der Ingenieure & Architekten,active,Publishing of journals and periodicals
138,1067385,Marcel Sennhauser,232658,Personalvorsorgestiftung von scienceindustries,active,Pension funding
138,1067385,Marcel Sennhauser,268069,scienceindustries,active,Activities of business and employers membership organisations
139,4302631,Bruno Weber-Gobet,4645644,Verein ARC -  Bildungsinstitut für Arbeitnehmende,active,Activities of trade unions
14,5135121,Lionel Ricou,7031474,"Institution de maintien, d'aide et de soins à domicile",active,"Nursing, district nursing"
140,5285695,Dominique Reber,4474379,Hirzel.Neef.Schmid.Konsulenten AG,active,Public relations and communication activities
140,5285695,Dominique Reber,6576142,Hirzel.Neef.Schmid.Konsulenten AG,active,Public relations and communication activities
140,5285695,Dominique Reber,7011674,FIPRA Schweiz GmbH,active,Public relations and communication activities
142,p25015040091,Luca Cirigliano,,,,
143,155871,Hansjörg Fasnacht,2749,Beat Bucher AG,active,"Wholesale of hardware, plumbing and heating equipment and supplies"
143,155871,Hansjörg Fasnacht,4407853,FaH Consulting Hansjörg Fasnacht,active,Public relations and communication activities
144,6311215,Maria Luisa Bernini Burkhard,6311314,Swiss Communication Agency Sagl,active,Advertising agencies
145,5617064,Raymond Loretan,7236043,SHI Swiss Hotels Investments S.A.,active,Activities of other holding companies
145,5617064,Raymond Loretan,6435542,Raymond Loretan,active,Advertising agencies
145,5617064,Raymond Loretan,4923606,Vins des Chevaliers SA,active,Growing of grapes
145,5617064,Raymond Loretan,275628,Klinik Pyramide am See AG,active,Special clinics
145,5617064,Raymond Loretan,799547,CENTRE HENRY DUNANT POUR LE DIALOGUE HUMANITAIRE,active,"Cultural, education, scientific and research organisations"
145,5617064,Raymond Loretan,5862926,"Klinik Pyramide am See AG, Zweigniederlassung",active,Special clinics
145,5617064,Raymond Loretan,7072960,GSMN Neuchâtel SA,active,Specialists medical practice activities
145,5617064,Raymond Loretan,133643,AEVIS Holding SA,active,Special clinics
145,5617064,Raymond Loretan,239537,Privatklinik Obach AG,active,General care hospitals
145,5617064,Raymond Loretan,310957,Ars Medica Clinic SA,active,Special clinics
145,5617064,Raymond Loretan,542095,Clinique médico-chirurgicale de Valère SA,active,General care hospitals
145,5617064,Raymond Loretan,646222,Salus Medica Clinic SA,active,General care hospitals
145,5617064,Raymond Loretan,709826,"SRF Schweizer Radio und Fernsehen, Zweigniederlassung der Schweizerischen Radio- und Fernsehgesellschaft",active,Television programming and broadcasting activities
145,5617064,Raymond Loretan,713217,"RTS Radio Télévision Suisse, succursale de la Société suisse de radiodiffusion et télévision",active,Television programming and broadcasting activities
145,5617064,Raymond Loretan,759168,"RSI Radiotelevisione svizzera di lingua italiana, succursale della Società svizzera di radiotelevisione",active,Television programming and broadcasting activities
145,5617064,Raymond Loretan,816423,"RTR Radiotelevisiun Svizra Rumantscha, succursala da la Societad svizra da radio e televisiun",active,Television programming and broadcasting activities
145,5617064,Raymond Loretan,79832,Clinique Générale - Ste-Anne SA,active,General care hospitals
145,5617064,Raymond Loretan,115376,FONDATION DE PREVOYANCE GENOLIER SWISS MEDICAL NETWORK,active,Pension funding
145,5617064,Raymond Loretan,116690,Fondation patronale de la Société Suisse des Explosifs,active,Pension funding
145,5617064,Raymond Loretan,161526,Institut de Médecine de Genolier,active,Medical laboratories
145,5617064,Raymond Loretan,646899,Schweizerische Radio- und Fernsehgesellschaft,active,Television programming and broadcasting activities
145,5617064,Raymond Loretan,680731,"Schweizerische Radio- und Fernsehgesellschaft, Zweigniederlassung swissinfo",active,Television programming and broadcasting activities
145,5617064,Raymond Loretan,311905,Valsynthese SA,active,Other research and experimental development on natural sciences and engineering
145,5617064,Raymond Loretan,711243,Publications Financières LSI SA,active,Publishing of journals and periodicals
145,5617064,Raymond Loretan,795853,GSMN Zürich AG,active,General care hospitals
145,5617064,Raymond Loretan,6262881,Les Hauts de Genolier SA,active,Residential nursing care activities
145,5617064,Raymond Loretan,6965730,Genolier Swiss Medical Network SA,active,Activities of other holding companies
145,5617064,Raymond Loretan,3485,GSMN Vaud SA,active,Special clinics
145,5617064,Raymond Loretan,15672,Société Suisse des Explosifs SA,active,Manufacture of explosives
145,5617064,Raymond Loretan,224525,Centre Médico-Chirurgical des Eaux-Vives SA,active,General medical practice activities
145,5617064,Raymond Loretan,239539,Klinik Villa im Park AG,active,Special clinics
145,5617064,Raymond Loretan,305387,SSE Finance SA,active,Fund management activities
146,,Thomas Moser,,,,
147,6549004,Judith Fischer,5870217,Suva,active,Accident insurance (SUVA)
148,5500705,Yves Weidmann,40711,Schweizerische Bankiervereinigung (SwissBanking),active,Activities of professional membership organisations
149,906925,Monika Maire-Hefti,709982,Fondation du Musée de la Tourbière,active,Museums activities
149,906925,Monika Maire-Hefti,3241,CSEM Centre Suisse d'Electronique et de Microtechnique SA - Recherche et Développement,active,Research and experimental development on biotechnology
149,906925,Monika Maire-Hefti,115586,Fondation des établissements cantonaux pour personnes âgées,active,Residential nursing care activities
149,906925,Monika Maire-Hefti,116484,"Fondation ""Les Billodes""",active,Special schools
15,4465470,Emil Kälin,,,,
150,4308851,Thierry Burkart,26062,Verein Barmelweid,active,Healthcare organisations
150,4308851,Thierry Burkart,26072,Aargauische Stiftung für Freiheit und Verantwortung in Politik und Wirtschaft,active,Other interest groups
150,4308851,Thierry Burkart,5601563,Buholz Immobilien AG,active,Buying and selling of own real estate
150,4308851,Thierry Burkart,6572460,Burkart Immobilien AG,active,Buying and selling of own real estate
150,4308851,Thierry Burkart,6723537,Obere Mühle Alterswohnungen AG,active,Management of real estate on a fee or contract basis
150,4308851,Thierry Burkart,299874,TCS-Zentrum Aargau AG,active,Other technical consultancy and planning
150,4308851,Thierry Burkart,6617619,"Touring Club Schweiz, Sektion Aargau",active,Other interest groups
150,4308851,Thierry Burkart,7190156,Swiss eMobility,active,"Cultural, education, scientific and research organisations"
150,4308851,Thierry Burkart,19176,Assista Protection juridique SA,active,Accident and indemnity insurance
150,4308851,Thierry Burkart,305247,Touring Club Suisse (TCS),active,Other interest groups
151,,Andreas Tschöpe,,,,
152,,Hannes Rettenmund,,,,
153,,Doris Güttinger,,,,
154,p29001217247,Babette Sigg Frank,,,,
155,,Claudio Kuster,,,,
156,,Maxim Wuersch,,,,
157,975318,Thomas Pletscher,4925481,economiesuisse,active,Activities of business and employers membership organisations
157,975318,Thomas Pletscher,751093,AG Haus der Wirtschaft,active,Management of real estate on a fee or contract basis
158,,Markus Flury,,,,
159,,Martin Bosshard,,,,
16,736914,Martin Zenhäusern,661233,Zenhäusern & Partner AG Unternehmensberatung für Öffentlichkeitsarbeit,active,Public relations and communication activities
16,736914,Martin Zenhäusern,5065812,Zenhäusern Akademie AG,active,"Further vocational training, adult education"
16,736914,Martin Zenhäusern,549040,Nimbus AG,active,Computer consultancy activities
16,736914,Martin Zenhäusern,816596,maxon motor ag,active,"Manufacture of electric motors, generators and transformers"
16,736914,Martin Zenhäusern,4896041,Synegration AG,active,Computer consultancy activities
160,p25000897613,Helene Müller-Bühler,,,,
162,5612965,Rudolf Zumbühl,5613340,ACADEMIE MOBILITE SA,active,"Further vocational training, adult education"
162,5612965,Rudolf Zumbühl,7190156,Swiss eMobility,active,"Cultural, education, scientific and research organisations"
162,5612965,Rudolf Zumbühl,305247,Touring Club Suisse (TCS),active,Other interest groups
163,,Ottilia Müller,,,,
164,,Jürg Maurer,,,,
165,,Franz Grüter,,,,
166,5725885,Patrick Hadi Huber,,,,
167,,Egger Michel,,,,
168,363,Bollag Josef,701374,NetJets Europe GmbH,active,Wholesale of other machinery and equipment
168,363,Bollag Josef,59257,"Flora, Bona und Rosa Bollag-Stiftung",active,Charitable institutions
168,363,Bollag Josef,4867290,IDS Living GmbH,active,Interior and spatial design
168,363,Bollag Josef,670972,eurogold service Zumbühl & Co. Handelsagentur,active,"Agents involved in the sale of furniture, household goods, hardware and ironmongery"
168,363,Bollag Josef,4659734,Klingelfuss+Cie.,active,Non-specialised wholesale trade
168,363,Bollag Josef,6842976,Dr. J. Bollag & Cie.,active,"Attorney, notary practice"
168,363,Bollag Josef,121306,Frenziek AG,active,"Accounting, bookkeeping and auditing activities; tax consultancy"
168,363,Bollag Josef,202090,MHN-AG Baugesellschaft zum Stein,active,Management of real estate on a fee or contract basis
168,363,Bollag Josef,675089,Mahr AG,active,Wholesale of other machinery and equipment
168,363,Bollag Josef,722655,Kolmar Group AG,active,"Wholesale of solid, liquid and gaseous fuels and related products"
168,363,Bollag Josef,6790803,R.R.E. Immo AG,active,Development of building projects
168,363,Bollag Josef,786744,Och Holding AG,active,Activities of head offices of other companies
168,363,Bollag Josef,813298,Burwill Commodities AG,active,Non-specialised wholesale trade
168,363,Bollag Josef,4080626,ASSOCIATION ROMANDE DES INTERMEDIAIRES FINANCIERS (ARIF),active,Other interest groups
168,363,Bollag Josef,6311301,Forum Schweizer Selbstregulierungsorganisationen (Forum-SRO),active,Other interest groups
168,363,Bollag Josef,101713,Elinex Holding AG,active,Activities of other holding companies
168,363,Bollag Josef,569177,Eltan Holding AG,active,Activities of other holding companies
168,363,Bollag Josef,577340,Tramondo AG,active,"Accounting, bookkeeping and auditing activities; tax consultancy"
168,363,Bollag Josef,4280390,Eltaver AG,active,Fund management activities
168,363,Bollag Josef,5860603,Eurogold Invest AG,active,Buying and selling of own real estate
168,363,Bollag Josef,5598721,Institut für Sicherheitsanalysen und strategisches Networking - Stiftung (ISSN),active,"Cultural, education, scientific and research organisations"
169,,Roger Hedi,,,,
17,p22005158400,Natacha Berberat,,,,
170,,Cherix François,,,,
171,5105362,Furrer Lorenz,6662437,Port-Associations GmbH,active,Public relations and communication activities
171,5105362,Furrer Lorenz,6872037,Tabascom GmbH,active,Investment intermediation
171,5105362,Furrer Lorenz,5485153,Berner Politgespräche GmbH,active,Activities of political organisations
171,5105362,Furrer Lorenz,6976376,Clé de Berne GmbH,active,"Restaurants, cafes, snack bars, tea rooms, ice-cream parlours"
171,5105362,Furrer Lorenz,7015365,Swiss Capital in Motion GmbH,active,Public relations and communication activities
171,5105362,Furrer Lorenz,6959305,Bergfahrt AG,active,Taxi operation
171,5105362,Furrer Lorenz,821909,Furrer.Hugi & Partner AG für Public Affairs und Kommunikationsmanagement,active,Public relations and communication activities
171,5105362,Furrer Lorenz,5315051,Polo Bern AG,active,Other amusement and recreation activities
171,5105362,Furrer Lorenz,6317730,yjoo communications ag,active,Public relations and communication activities
171,5105362,Furrer Lorenz,6337943,yjoo communications ag,active,Business and other management consultancy activities
172,6562803,Nussbaumer Michael,6562984,"Michi Nussbaumer, Grafik und Typografie",active,Graphic design and visual communication
173,p26001067974,Tettamanti Elvio,,,,
174,,Wartenweiler Johannes,,,,
175,121692,Cueni Thomas,357518,Verein Hilfe für seelisch Leidende Basel,active,Charitable institutions
175,121692,Cueni Thomas,6783413,Stiftung Hilfe für seelisch Leidende Basel,active,Charitable institutions
175,121692,Cueni Thomas,163174,Interpharma,active,Other research and experimental development on natural sciences and engineering
176,625628,Zürcher Montali Ines,,,,
177,1020194,Hofmann Max,,,,
178,p28002992189,Mühlethaler Jan,,,,
179,477648,Studerus Konrad,4467299,Labor Veritas AG,active,Technical testing and analysis
179,477648,Studerus Konrad,5718242,Studerus und Partner AG,active,Business and other management consultancy activities
179,477648,Studerus Konrad,232528,Personalvorsorgestiftung Labor Veritas,active,Pension funding
179,477648,Studerus Konrad,239607,Probat Heizungssysteme AG,active,"lnstallation of heating, ventilation and air-conditioning systems"
18,,Alain Bovard,,,,
180,,Sutter Sigrid,,,,
181,p25004801411,Björk Michaela,,,,
182,45382,Baertschi François,,,,
183,975543,Maurer Thomas C.,5698245,Maurer Partner Communications AG,active,Public relations and communication activities
183,975543,Maurer Thomas C.,4398641,Thomas C. Maurer & Partner,active,Public relations and communication activities
184,335092,Meyer Urs F.,24080,Meyer-Wyss & Partner AG,active,Other information service activities n.e.c.
184,335092,Meyer Urs F.,114874,Stiftung der Schweizer Werbung für die Lauterkeit in der kommerziellen Kommunikation,active,Other interest groups
184,335092,Meyer Urs F.,240380,"ProLitteris, Schweizerische Urheberrechtsgesellschaft für Literatur und bildende Kunst, Genossenschaft",active,"Attorney, notary practice"
184,335092,Meyer Urs F.,292160,Stiftung des Schweizerischen Zeitungsverleger-Verbandes zur Sicherung des schweizerischen Pressewesens,active,"Cultural, education, scientific and research organisations"
184,335092,Meyer Urs F.,662675,Medialex,active,"Cultural, education, scientific and research organisations"
185,6446441,Werder Christina,224039,Pensionskassengenossenschaft des Schweizerischen Gewerkschaftsbundes,active,Pension funding
186,848993,Karch Herbert,116807,Stiftung für Konsumentenschutz,active,Other interest groups
186,848993,Karch Herbert,765645,"INTERCOOPERATION, Swiss Foundation for Development and International Cooperation",active,"Cultural, education, scientific and research organisations"
186,848993,Karch Herbert,6480102,Karch Kampagnen GmbH,active,Secretarial activities
186,848993,Karch Herbert,683183,Kleinbauern-Warenversand GmbH in Liquidation,inbreakup,Retail sale via mail order houses or via Internet
187,,Geninazzi Angelo,,,,
188,p21008036913,Simonet Denis,,,,
189,6970879,Reimann Hans Peter,6970750,Hanspeter Reimann Schreinerarbeiten,active,Joinery installation
19,5591444,Stefan Vannoni,5572862,Institut für Wirtschaftsstudien Basel AG,active,Other business support service activities n.e.c.
190,,Strozzi Elena Antonella,,,,
191,p22010017274,Suter Bertil,,,,
192,,Bachmann Jürg,,,,
193,816649,Schwitter Stephan,6943418,Energieplattform Immobilien (EPImmo),active,Web portals
193,816649,Schwitter Stephan,5847367,Stiftung Solinvest,active,Other interest groups
194,,Salzmann Bernard,,,,
195,524178,Widmer Andreas,318012,Stiftung St.Galler Landwirtschaft,active,"Cultural, education, scientific and research organisations"
195,524178,Widmer Andreas,785660,St. Galler Bauernverband,active,Activities of professional membership organisations
195,524178,Widmer Andreas,154616,HULFTEGG Finanz- und Verwaltungs AG,active,Management of real estate on a fee or contract basis
195,524178,Widmer Andreas,4830867,Animaltruck AG,active,Freight transport by road
195,524178,Widmer Andreas,37437,Genossenschaft pro Mosnang,active,"Cultural, education, scientific and research organisations"
195,524178,Widmer Andreas,318134,Vorsorgestiftung der Schweizerischen Landwirtschaft,active,Pension funding
195,524178,Widmer Andreas,6444785,Förderverein energietal toggenburg,active,"Other professional, scientific and technical activities n.e.c."
196,5912967,Kuert Killer Matthias,117560,Sicherheitsfonds BVG,active,Pension funding
197,,Zimmermann Thomas,,,,
198,4034403,Besio Beatrix,310350,Schweizer Milchproduzenten SMP Genossenschaft,active,Activities of professional membership organisations
199,p27007321472,Paltenghi Luca,,,,
2,4937033,Donat Schneider,539751,Affolter Mühle und Transport AG,active,Manufacture of grain mill products
2,4937033,Donat Schneider,649247,BBV Treuhand AG,active,"Accounting, bookkeeping and auditing activities; tax consultancy"
2,4937033,Donat Schneider,5522132,aaremilch AG,active,Business and other management consultancy activities
20,,Matthias Dietrich,,,,
200,6951145,Lauber Tamara,145354,Genossenschaft Hauseigentümerverband Zürich,active,Other interest groups
201,728838,Rodewald Raimund,293395,Stiftung Umwelt-Einsatz Schweiz (SUS),active,Other interest groups
201,728838,Rodewald Raimund,588305,Rottebrigge-Alte Mühle,active,"Cultural, education, scientific and research organisations"
201,728838,Rodewald Raimund,5870237,Fundaziun Pro Terra Engiadina,active,Landscape service activities
201,728838,Rodewald Raimund,268028,Stiftung Landschaftsschutz Schweiz,active,Other interest groups
202,,Ruiz Rebecca,,,,
203,,Ulrico Kessler,,,,
204,5397624,Tschirky Erich,5760940,wellatwork.ch GmbH,active,Web portals
204,5397624,Tschirky Erich,292972,Stiftung Märtplatz,active,"Further vocational training, adult education"
204,5397624,Tschirky Erich,4645644,Verein ARC -  Bildungsinstitut für Arbeitnehmende,active,Activities of trade unions
204,5397624,Tschirky Erich,4996816,PHS Public Health Services GmbH,active,Other paramedical activities
204,5397624,Tschirky Erich,6371095,syneric GmbH,active,"Other professional, scientific and technical activities n.e.c."
204,5397624,Tschirky Erich,4878047,Stiftung Synapsis - Alzheimer Forschung Schweiz AFS,active,Research and experimental development on biotechnology
205,,Kaufmann Hans-Peter,,,,
206,,Weissen Roman,,,,
208,139779,Dürr Lucius,5344085,Schweizerischer Versicherungsverband (SVV),active,Activities of business and employers membership organisations
